ffff8e0b42b03000 2446167761 S Ci:1:001:0 s a3 00 0000 0001 0004 4 <
ffff8e0b42b03000 2446167797 C Ci:1:001:0 0 4 = 00010000
ffff8e0b42b03000 2446167814 S Ci:1:001:0 s a3 00 0000 0002 0004 4 <
ffff8e0b42b03000 2446167846 C Ci:1:001:0 0 4 = 00010000
ffff8e0b42b03000 2446167863 S Ci:1:001:0 s a3 00 0000 0003 0004 4 <
ffff8e0b42b03000 2446167896 C Ci:1:001:0 0 4 = 00010000
ffff8e0b42b03000 2446167908 S Ci:1:001:0 s a3 00 0000 0004 0004 4 <
ffff8e0b42b03000 2446167924 C Ci:1:001:0 0 4 = 00010000
ffff8e0b42b03000 2446167934 S Ci:1:001:0 s a3 00 0000 0005 0004 4 <
ffff8e0b42b03000 2446167951 C Ci:1:001:0 0 4 = 07050000
ffff8e0b42b03000 2446167959 S Ci:1:001:0 s a3 00 0000 0006 0004 4 <
ffff8e0b42b03000 2446167974 C Ci:1:001:0 0 4 = 00010000
ffff8e0b42b03000 2446167984 S Ci:1:001:0 s a3 00 0000 0007 0004 4 <
ffff8e0b42b03000 2446167998 C Ci:1:001:0 0 4 = 07010000
ffff8e0b42b03000 2446168014 S Ci:1:001:0 s a3 00 0000 0008 0004 4 <
ffff8e0b42b03000 2446168029 C Ci:1:001:0 0 4 = 00010000
ffff8e0b42b03000 2446168040 S Ci:1:001:0 s a3 00 0000 0009 0004 4 <
ffff8e0b42b03000 2446168056 C Ci:1:001:0 0 4 = 00010000
ffff8e0b42b03000 2446168067 S Ci:1:001:0 s a3 00 0000 000a 0004 4 <
ffff8e0b42b03000 2446168081 C Ci:1:001:0 0 4 = 07010000
ffff8e0b42b03000 2446168092 S Ci:1:001:0 s a3 00 0000 000b 0004 4 <
ffff8e0b42b03000 2446168107 C Ci:1:001:0 0 4 = 00010000
ffff8e0b42b03000 2446168118 S Ci:1:001:0 s a3 00 0000 000c 0004 4 <
ffff8e0b42b03000 2446168132 C Ci:1:001:0 0 4 = 00010000
ffff8e0b49993240 2446168142 S Ii:1:001:1 -115:2048 4 <
ffff8e0b42b03000 2446168152 S Ci:1:001:0 s a3 00 0000 000a 0004 4 <
ffff8e0b42b03000 2446168174 C Ci:1:001:0 0 4 = 07010000
ffff8e0b42b03000 2446168187 S Co:1:001:0 s 23 01 0002 000a 0000 0
ffff8e0b49993240 2446168268 C Ii:1:001:1 0:2048 2 = 0000
ffff8e0b49993240 2446168277 S Ii:1:001:1 -115:2048 4 <
ffff8e0b42b03000 2446209060 C Co:1:001:0 0 0
ffff8e0b49993240 2446209100 C Ii:1:001:1 0:2048 2 = 0004
ffff8e0b49993240 2446209106 S Ii:1:001:1 -115:2048 4 <
ffff8e0b42b03000 2446250074 S Ci:1:001:0 s a3 00 0000 000a 0004 4 <
ffff8e0b42b03000 2446250096 C Ci:1:001:0 0 4 = 03010400
ffff8e0b42b03000 2446250116 S Co:1:001:0 s 23 01 0012 000a 0000 0
ffff8e0b42b03000 2446250139 C Co:1:001:0 0 0
ffff8e0b475230c0 2446261040 S Ci:1:027:0 s 80 00 0000 0000 0002 2 <
ffff8e0b475230c0 2446261130 C Ci:1:027:0 0 2 = 0000
ffff8e0c451cca80 2446261165 S Ci:1:001:0 s a3 00 0000 000a 0004 4 <
ffff8e0c451cca80 2446261186 C Ci:1:001:0 0 4 = 03010000
ffff8e0b475230c0 2446273382 S Bo:1:027:1 -115 96 = 01000000 60000000 02004004 02000000 00000000 00000000 00000000 00000000
ffff8e0b475230c0 2446273544 C Bo:1:027:1 0 96 >
ffff8e0b475230c0 2446273620 S Ii:1:027:5 -115:1 32 <
ffff8e0b475230c0 2446282731 C Ii:1:027:5 0:1 8 = 00000000 38000000
ffff8e0b475230c0 2446282810 S Bi:1:027:1 -115 4196 <
ffff8e0b475230c0 2446282913 C Bi:1:027:1 0 56 = 01000000 38000000 02004005 02000000 8c9b0114 00000000 00000000 00000000
ffff8e0b42b03000 2446291400 S Bo:1:027:1 -115 80 = 01000000 50000000 66004204 02000000 8c9b0114 00000000 00000000 00000000
ffff8e0b42b03000 2446291552 C Bo:1:027:1 0 80 >
ffff8e0b42b03000 2446291627 S Ii:1:027:5 -115:1 32 <
ffff8e0b42b03000 2446302731 C Ii:1:027:5 0:1 8 = 00000000 2c000000
ffff8e0b42b03000 2446302780 S Bi:1:027:1 -115 4196 <
ffff8e0b42b03000 2446302870 C Bi:1:027:1 0 44 = 01000000 2c000000 66004205 02000000 8c9b0114 85000000 00000000 00000000
ffff8e0b42b03000 2446311684 S Bo:1:027:1 -115 56 = 01000000 38000000 68004004 02000000 00000000 00000000 00000000 00000000
ffff8e0b42b03000 2446311762 C Bo:1:027:1 0 56 >
ffff8e0b42b03000 2446311834 S Ii:1:027:5 -115:1 32 <
ffff8e0b42b03000 2446349687 C Ii:1:027:5 0:1 8 = 00000000 2c000000
ffff8e0b42b03000 2446349789 S Bi:1:027:1 -115 4196 <
ffff8e0b42b03000 2446349885 C Bi:1:027:1 0 44 = 01000000 2c000000 68004005 02000000 00000000 00000000 00000000 00000000
ffff8e0b42b03000 2446359336 S Bo:1:027:1 -115 80 = 01000000 50000000 66004204 02000000 8c9b0114 00000000 00000000 00000000
ffff8e0b42b03000 2446359486 C Bo:1:027:1 0 80 >
ffff8e0b42b03000 2446359560 S Ii:1:027:5 -115:1 32 <
ffff8e0b42b03000 2446406759 C Ii:1:027:5 0:1 8 = 00000000 48000000
ffff8e0b42b03000 2446406922 S Bi:1:027:1 -115 4196 <
ffff8e0b42b03000 2446407063 C Bi:1:027:1 0 72 = 01000000 48000000 66004205 02000000 8c9b0114 00000000 00000000 00000000
ffff8e0b42b03000 2446424411 S Ii:1:027:5 -115:1 32 <
ffff8e0b42b03000 2449405764 C Ii:1:027:5 0:1 8 = 03000000 00000000
ffff8e0b42b03000 2449425580 S Bo:1:027:1 -115 100 = 01000000 64000000 2f004204 02000000 8c9b0114 00000000 00000000 00000000
ffff8e0b42b03000 2449425824 C Bo:1:027:1 0 100 >
ffff8e0b42b03000 2449425952 S Ii:1:027:5 -115:1 32 <
ffff8e0b42b03000 2449454767 C Ii:1:027:5 0:1 8 = 00000000 2c000000
ffff8e0b42b03000 2449454917 S Bi:1:027:1 -115 4196 <
ffff8e0b42b03000 2449455034 C Bi:1:027:1 0 44 = 01000000 2c000000 2f004205 02000000 8c9b0114 47000000 00000000 00000000
ffff8e0b42b03000 2449473170 S Bo:1:027:1 -115 80 = 01000000 50000000 66004204 02000000 8c9b0114 00000000 00000000 00000000
ffff8e0b42b03000 2449473284 C Bo:1:027:1 0 80 >
ffff8e0b42b03000 2449473397 S Ii:1:027:5 -115:1 32 <
ffff8e0b42b03000 2449481247 C Ii:1:027:5 0:1 8 = 00000000 2c000000
ffff8e0b42b03000 2449481405 S Bi:1:027:1 -115 4196 <
ffff8e0b42b03000 2449481540 C Bi:1:027:1 0 44 = 01000000 2c000000 66004205 02000000 8c9b0114 47000000 00000000 00000000
ffff8e0b42b03000 2449499676 S Bo:1:027:1 -115 56 = 01000000 38000000 68004004 02000000 00000000 00000000 00000000 00000000
ffff8e0b42b03000 2449499813 C Bo:1:027:1 0 56 >
ffff8e0b42b03000 2449499916 S Ii:1:027:5 -115:1 32 <
ffff8e0b42b03000 2449514793 C Ii:1:027:5 0:1 8 = 00000000 2c000000
ffff8e0b42b03000 2449514970 S Bi:1:027:1 -115 4196 <
ffff8e0b42b03000 2449515148 C Bi:1:027:1 0 44 = 01000000 2c000000 68004005 02000000 00000000 00000000 00000000 00000000
ffff8e0b475230c0 2449535108 S Bo:1:027:1 -115 56 = 01000000 38000000 04004004 02000000 00000000 00000000 00000000 00000000
ffff8e0b475230c0 2449535258 C Bo:1:027:1 0 56 >
ffff8e0b475230c0 2449535385 S Ii:1:027:5 -115:1 32 <
ffff8e0b475230c0 2449540759 C Ii:1:027:5 0:1 8 = 00000000 2c000000
ffff8e0b475230c0 2449540893 S Bi:1:027:1 -115 4196 <
ffff8e0b475230c0 2449541059 C Bi:1:027:1 0 44 = 01000000 2c000000 04004005 02000000 00000000 00000000 00000000 00000000
ffff8e0b475230c0 2449560233 S Bo:1:027:1 -115 96 = 01000000 60000000 02004004 02000000 00000000 00000000 00000000 00000000
ffff8e0b475230c0 2449560407 C Bo:1:027:1 0 96 >
ffff8e0b475230c0 2449560544 S Ii:1:027:5 -115:1 32 <
ffff8e0b475230c0 2449567862 C Ii:1:027:5 0:1 8 = 00000000 38000000
ffff8e0b475230c0 2449568063 S Bi:1:027:1 -115 4196 <
ffff8e0b475230c0 2449568232 C Bi:1:027:1 0 56 = 01000000 38000000 02004005 02000000 8c9b0114 00000000 00000000 00000000
ffff8e0b42b03000 2449585308 S Bo:1:027:1 -115 56 = 01000000 38000000 8a004004 02000000 00000000 00000000 00000000 00000000
ffff8e0b42b03000 2449585444 C Bo:1:027:1 0 56 >
ffff8e0b42b03000 2449585565 S Ii:1:027:5 -115:1 32 <
ffff8e0b42b03000 2449593890 C Ii:1:027:5 0:1 8 = 00000000 2c000000
ffff8e0b42b03000 2449594088 S Bi:1:027:1 -115 4196 <
ffff8e0b42b03000 2449594251 C Bi:1:027:1 0 44 = 01000000 2c000000 8a004005 02000000 00000000 00000000 00000000 00000000
ffff8e0b42b03000 2449611396 S Bo:1:027:1 -115 80 = 01000000 50000000 66004204 02000000 8c9b0114 00000000 00000000 00000000
ffff8e0b42b03000 2449611552 C Bo:1:027:1 0 80 >
ffff8e0b42b03000 2449611682 S Ii:1:027:5 -115:1 32 <
ffff8e0b42b03000 2449662921 C Ii:1:027:5 0:1 8 = 00000000 48000000
ffff8e0b42b03000 2449663136 S Bi:1:027:1 -115 4196 <
ffff8e0b42b03000 2449663315 C Bi:1:027:1 0 72 = 01000000 48000000 66004205 02000000 8c9b0114 00000000 00000000 00000000
ffff8e0b42b03000 2449680475 S Ii:1:027:5 -115:1 32 <
ffff8e0b42b03000 2451680648 C Ii:1:027:5 -2:1 0
ffff8e0b42b03000 2451697855 S Ii:1:027:5 -115:1 32 <
ffff8e0b42b03000 2452929910 C Ii:1:027:5 0:1 8 = 03000000 00000000
ffff8e0b42b03000 2452947236 S Bo:1:027:1 -115 92 = 01000000 5c000000 6c004004 02000000 8c9b0114 00000000 00000000 00000000
ffff8e0b42b03000 2452947404 C Bo:1:027:1 0 92 >
ffff8e0b42b03000 2452947541 S Ii:1:027:5 -115:1 32 <
ffff8e0b42b03000 2452958885 C Ii:1:027:5 0:1 8 = 00000000 60000000
ffff8e0b42b03000 2452959107 S Bi:1:027:1 -115 4196 <
ffff8e0b42b03000 2452959321 C Bi:1:027:1 0 96 = 01000000 60000000 6c004005 02000000 8c9b0114 00000000 00000000 00000000
ffff8e0b42b03000 2452977229 S Bo:1:027:1 -115 80 = 01000000 50000000 66004204 02000000 8c9b0114 00000000 00000000 00000000
ffff8e0b42b03000 2452977402 C Bo:1:027:1 0 80 >
ffff8e0b42b03000 2452977537 S Ii:1:027:5 -115:1 32 <
ffff8e0b42b03000 2453028770 C Ii:1:027:5 0:1 8 = 00000000 48000000
ffff8e0b42b03000 2453028901 S Bi:1:027:1 -115 4196 <
ffff8e0b42b03000 2453029084 C Bi:1:027:1 0 72 = 01000000 48000000 66004205 02000000 8c9b0114 00000000 00000000 00000000
ffff8e0b42b03000 2453046970 S Ii:1:027:5 -115:1 32 <
ffff8e0b42b03000 2455047238 C Ii:1:027:5 -2:1 0
ffff8e0b42b03000 2455064696 S Ii:1:027:5 -115:1 32 <
ffff8e0b42b03000 2455460761 C Ii:1:027:5 0:1 8 = 03000000 00000000
ffff8e0b42b03000 2455478528 S Bo:1:027:1 -115 92 = 01000000 5c000000 6c004004 02000000 8c9b0114 00000000 00000000 00000000
ffff8e0b42b03000 2455478650 C Bo:1:027:1 0 92 >
ffff8e0b42b03000 2455478770 S Ii:1:027:5 -115:1 32 <
ffff8e0b42b03000 2455490893 C Ii:1:027:5 0:1 8 = 00000000 60000000
ffff8e0b42b03000 2455491103 S Bi:1:027:1 -115 4196 <
ffff8e0b42b03000 2455491266 C Bi:1:027:1 0 96 = 01000000 60000000 6c004005 02000000 8c9b0114 00000000 00000000 00000000
ffff8e0b42b03000 2455509205 S Bo:1:027:1 -115 80 = 01000000 50000000 66004204 02000000 8c9b0114 00000000 00000000 00000000
ffff8e0b42b03000 2455509318 C Bo:1:027:1 0 80 >
ffff8e0b42b03000 2455509442 S Ii:1:027:5 -115:1 32 <
ffff8e0b42b03000 2455561737 C Ii:1:027:5 0:1 8 = 00000000 48000000
ffff8e0b42b03000 2455561908 S Bi:1:027:1 -115 4196 <
ffff8e0b42b03000 2455562099 C Bi:1:027:1 0 72 = 01000000 48000000 66004205 02000000 8c9b0114 00000000 00000000 00000000
ffff8e0b42b03000 2455580312 S Ii:1:027:5 -115:1 32 <
ffff8e0b42b03000 2457580541 C Ii:1:027:5 -2:1 0
ffff8e0b42b03000 2457597690 S Ii:1:027:5 -115:1 32 <
ffff8e0b42b03000 2458785817 C Ii:1:027:5 0:1 8 = 03000000 00000000
ffff8e0b42b03000 2458803127 S Bo:1:027:1 -115 92 = 01000000 5c000000 6c004004 02000000 8c9b0114 00000000 00000000 00000000
ffff8e0b42b03000 2458803298 C Bo:1:027:1 0 92 >
ffff8e0b42b03000 2458803438 S Ii:1:027:5 -115:1 32 <
ffff8e0b42b03000 2458815921 C Ii:1:027:5 0:1 8 = 00000000 60000000
ffff8e0b42b03000 2458816128 S Bi:1:027:1 -115 4196 <
ffff8e0b42b03000 2458816332 C Bi:1:027:1 0 96 = 01000000 60000000 6c004005 02000000 8c9b0114 00000000 00000000 00000000
ffff8e0c451cca80 2458834190 S Bo:1:027:1 -115 80 = 01000000 50000000 66004204 02000000 8c9b0114 00000000 00000000 00000000
ffff8e0c451cca80 2458834357 C Bo:1:027:1 0 80 >
ffff8e0c451cca80 2458834427 S Ii:1:027:5 -115:1 32 <
ffff8e0c451cca80 2458886819 C Ii:1:027:5 0:1 8 = 00000000 48000000
ffff8e0c451cca80 2458886937 S Bi:1:027:1 -115 4196 <
ffff8e0c451cca80 2458887111 C Bi:1:027:1 0 72 = 01000000 48000000 66004205 02000000 8c9b0114 00000000 00000000 00000000
ffff8e0c451cca80 2458904445 S Ii:1:027:5 -115:1 32 <
ffff8e0c451cca80 2460904666 C Ii:1:027:5 -2:1 0
ffff8e0c451cca80 2460921546 S Ii:1:027:5 -115:1 32 <
ffff8e0c451cca80 2461657976 C Ii:1:027:5 0:1 8 = 03000000 00000000
ffff8e0c451cca80 2461675520 S Bo:1:027:1 -115 92 = 01000000 5c000000 6c004004 02000000 8c9b0114 00000000 00000000 00000000
ffff8e0c451cca80 2461675694 C Bo:1:027:1 0 92 >
ffff8e0c451cca80 2461675766 S Ii:1:027:5 -115:1 32 <
ffff8e0c451cca80 2461864813 C Ii:1:027:5 0:1 8 = 00000000 2c000000
ffff8e0c451cca80 2461864911 S Bi:1:027:1 -115 4196 <
ffff8e0c451cca80 2461865340 C Bi:1:027:1 0 44 = 01000000 2c000000 6c004005 02000000 8c9b0114 59000000 00000000 00000000
ffff8e0c451cca80 2461883710 S Bo:1:027:1 -115 56 = 01000000 38000000 68004004 02000000 00000000 00000000 00000000 00000000
ffff8e0c451cca80 2461883846 C Bo:1:027:1 0 56 >
ffff8e0c451cca80 2461883910 S Ii:1:027:5 -115:1 32 <
ffff8e0c451cca80 2461900819 C Ii:1:027:5 0:1 8 = 00000000 2c000000
ffff8e0c451cca80 2461900919 S Bi:1:027:1 -115 4196 <
ffff8e0c451cca80 2461901034 C Bi:1:027:1 0 44 = 01000000 2c000000 68004005 02000000 00000000 00000000 00000000 00000000
ffff8e0c451cca80 2461918957 S Bo:1:027:1 -115 108 = 01000000 6c000000 6e004004 02000000 8c9b0114 00000000 00000000 00000000
ffff8e0c451cca80 2461919159 C Bo:1:027:1 0 108 >
ffff8e0c451cca80 2461919229 S Ii:1:027:5 -115:1 32 <
ffff8e0c451cca80 2461925938 C Ii:1:027:5 0:1 8 = 00000000 2c000000
ffff8e0c451cca80 2461926096 S Bi:1:027:1 -115 4196 <
ffff8e0c451cca80 2461926275 C Bi:1:027:1 0 44 = 01000000 2c000000 6e004005 02000000 8c9b0114 8d000000 00000000 00000000
ffff8e0c451cca80 2461943252 S Bo:1:027:1 -115 56 = 01000000 38000000 68004004 02000000 00000000 00000000 00000000 00000000
ffff8e0c451cca80 2461943402 C Bo:1:027:1 0 56 >
ffff8e0c451cca80 2461943473 S Ii:1:027:5 -115:1 32 <
ffff8e0c451cca80 2461957827 C Ii:1:027:5 0:1 8 = 00000000 2c000000
ffff8e0c451cca80 2461957929 S Bi:1:027:1 -115 4196 <
ffff8e0c451cca80 2461958093 C Bi:1:027:1 0 44 = 01000000 2c000000 68004005 02000000 00000000 00000000 00000000 00000000
ffff8e0b475230c0 2461975486 S Bo:1:027:1 -115 56 = 01000000 38000000 6d004004 02000000 00000000 00000000 00000000 00000000
ffff8e0b475230c0 2461975635 C Bo:1:027:1 0 56 >
ffff8e0b475230c0 2461975759 S Ii:1:027:5 -115:1 32 <
ffff8e0b475230c0 2461980824 C Ii:1:027:5 0:1 8 = 00000000 2c000000
ffff8e0b475230c0 2461980982 S Bi:1:027:1 -115 4196 <
ffff8e0b475230c0 2461981143 C Bi:1:027:1 0 44 = 01000000 2c000000 6d004005 02000000 00000000 00000000 00000000 00000000
ffff8e0b475230c0 2461997407 S Bo:1:027:1 -115 56 = 01000000 38000000 04004004 02000000 00000000 00000000 00000000 00000000
ffff8e0b475230c0 2461997551 C Bo:1:027:1 0 56 >
ffff8e0b475230c0 2461997664 S Ii:1:027:5 -115:1 32 <
ffff8e0b475230c0 2462002825 C Ii:1:027:5 0:1 8 = 00000000 2c000000
ffff8e0b475230c0 2462002989 S Bi:1:027:1 -115 4196 <
ffff8e0b475230c0 2462003151 C Bi:1:027:1 0 44 = 01000000 2c000000 04004005 02000000 00000000 00000000 00000000 00000000
